TÍTULO,AÑO,ENTIDAD,ENLACE,NOMBRE_ARCHIVO
Guías Nacionales de Atención Integral de Salud Sexual y Reproductiva.,2004,Minsa,https://bvs.minsa.gob.pe/local/dgsp/63_guiasnac.pdf,guia_nacional_atencion_integral_salud_sexual_y_reproductiva_2004.pdf
Informe Prevención y Erradicación de la Falta de Respeto y el Maltrato durante la Atención del Parto en Centros de Salud.,2014,OMS,https://iris.who.int/bitstream/handle/10665/134590/WHO_RHR_14.23_spa.pdf?sequence=1,prevencion_y_erradicacion_de_la_falta_de_respeto_y_maltrato_durante_el_parto_OMS.pdf
"Ley 30364 “Ley para prevenir, sancionar y erradicar la violencia contra las mujeres y los integrantes del grupo familiar”",2015,Gobierno peruano,http://www.mimp.gob.pe/files/transparencia/ley-30364.pdf,Ley_violencia_contra_la_mujer.pdf
Decreto Supremo 008 - 2016 - MI “Plan Nacional Contra la Violencia de Género 2016-2021”,2016,Minsa,https://www.defensoria.gob.pe/wp-content/uploads/2021/11/Balance-sobre-la-pol%C3%ADtica-p%C3%BAblica-contra-la-violencia-hacia-las-mujeres-en-el-Per%C3%BA.pdf,Plan_nacional_contra_la_violencia_de_genero.pdf
Decreto Supremo 009 - 2016 “Reglamento de Ley N° 30364”,2016,Gobierno peruano,https://www.congreso.gob.pe/Docs/DefensoriaMujer/files/normas-legales/reglamento-ley-violencia-familiar-30364.pdf,Reglamento_de_ley_contra_la_violencia_contra_la_mujer.pdf
Norma Técnica de Salud: Atención del parto vertical en el marco de los Derechos Humanos con pertinencia inercultural,2019,Minsa,https://cdn.www.gob.pe/uploads/document/file/1226907/501620200811-2899800-wh6z81.pdf?v=1597184409,Norma_tecnica_de_salud_atencion_del_parto_vertical_en_el_marco_de_los_derechos_humanos_con_pertinencia_intercultural.pdf
Decreto Supremo que modifica el reglamento de la 30364.,2019,Gobierno peruano,https://busquedas.elperuano.pe/dispositivo/NL/1747442-1,Se_incluye_la_violencia_obstetrica_en_el_reglamento_de_ley.pdf
